ticket_id,text_snippet,topic,urgency,next_action,is_complete,clarification_question,notes
12224,"Medical Data Encryption Assistance Required: The encryption process for medical data has failed, leading to the exposure of patient information becaus",Technical / Online Access,High,Forward to technical support team,True,,The ticket will be forwarded to the technical support team for further assistance.
3196,Subject: Assistance Needed with Incorrect Invoice Totals: I am encountering problems with incorrect invoice totals due to a billing system glitch. Des,Billing / Payment,Medium,Forward to billing team,True,,The ticket will be forwarded to the billing team for further assistance.
6009,Details on Xero Integration for Project Management: Could you provide detailed information on the Xero integration for project management SaaS? Your s,Other,Low,Send standard FAQ or self-service link,True,,The next step is to provide the customer with the relevant FAQ or self-service link regarding the Xero integration for project management.
538,"Problem with Mesh Network Connection: Facing connectivity challenges with the Mesh Network, which is impacting digital marketing efforts. The issue mi",Technical / Online Access,Medium,Forward to technical support team,True,,The ticket will be forwarded to the technical support team for resolution.
5263,Project Support: Implement database optimization to enhance performance and decrease latency in the project management platform for better efficiency ,Technical / Online Access,Medium,Forward to technical support team,True,,The ticket is ready to be forwarded to the appropriate team for further handling.
13770,"System Outage Impacting Data Analytics Operations: Dear Customer Support, we are currently facing a system outage that has disrupted our data analytic",Technical / Online Access,High,Forward to technical support team,True,,The ticket will be forwarded to the technical support team for further assistance.
4684,"Medical Data Breach Due to Firewall Issues: An unexpected medical data breach happened due to inadequate firewall rules, and unauthorized access was d",Technical / Online Access,High,Forward to technical support team,True,,The ticket will be forwarded to the technical support team for further assistance.
14077,Support for Employee Turnover Concerns: We are facing significant employee turnover issues due to insufficient onboarding and limited career advanceme,Other,Medium,Request more information from customer,False,Can you specify what type of assistance you are looking for regarding employee turnover?,"If you need further assistance or want to proceed with the next steps, please let me know!"
10503,Data Breach Concern in Apache Hadoop Environment: Greetings Customer Support. I am reaching out to inform you about a data breach that may be related ,Technical / Online Access,High,Forward to technical support team,True,,This ticket will be forwarded to the technical support team for prompt assistance.
8272,"Problem with Website: Facing irregular website performance on Squarespace. It could be due to recent plugin updates. I have cleared the cache, updated",Technical / Online Access,Medium,Forward to technical support team,True,,The ticket is now set to be forwarded to the technical support team for assistance with the website performance issue.
2626,"Problem with Google Analytics Installation: Hello Customer Support, I am reaching out to report an issue with our website's analytics tracking. It see",Technical / Online Access,Medium,Forward to technical support team,True,,The ticket will be forwarded to the technical support team for further assistance with the Google Analytics issue.
18248,Request for Guidance on Data Analytics Tools Integration: I am reaching out to seek assistance in integrating data analytics tools for enhancing inves,Other,Medium,Request more information from customer,True,,The next action to take is to request more information from the customer.
17756,"Support for Financial Analytics Dashboard: Experienced an unresponsive financial analytics dashboard during a crucial investment analysis session, whi",Technical / Online Access,High,Forward to technical support team,True,,The ticket will be forwarded to the technical support team for investigation and resolution.
16437,"Issue with Excel Integration Causing Project Data Loss: Hello Customer Support, I am reaching out to report an issue with the Excel integration, which",Technical / Online Access,High,Forward to technical support team,True,,"- **Topic**: Classified as ""Technical / Online Access""
- **Urgency**: Scored as ""High""
- **Completeness**: The ticket is complete without any issues needing clarification.
- **Next Action**: The ticket will be forwarded to the technical support team for resolution."
15841,Improve Security Measures in Healthcare Apps: seek to strengthen security protocols to safeguard medical data systems in healthcare applications softw,Technical / Online Access,High,Request more information from customer,False,Could you please specify the exact technical issue or security concern you are experiencing?,Please reach out to the customer for further details regarding their specific security concerns.
19700,"Report on Investment Predictions Issue: Hello Customer Support, I am reaching out to share an issue I encountered. The investment predictions did not ",Other,Medium,Request more information from customer,True,,Would you like to proceed with sending a request for more information to the customer?
1070,Problem with Data Analytics Software: The data analytics tools are unable to start because of compatibility problems after updating Docker. I restarte,Technical / Online Access,High,Forward to technical support team,True,,The ticket will be forwarded to the technical support team for resolution.
794,Improved Security for Medical Data: It is important to implement robust security measures for medical data across various software and hardware system,Technical / Online Access,High,Forward to technical support team,True,,The ticket will be forwarded to the technical support team for further action on the urgent security measures for medical data.
8607,"Issue with Website Analytics Dashboard Not Updating: Respected Customer Support, I am encountering a problem where my website analytics dashboard is n",Technical / Online Access,High,Forward to technical support team,True,,The ticket will be forwarded to the technical support team for resolution.
11993,"Patient Record Security Breach: Dear Customer Support, <br><br>I am contacting you to address an urgent matter involving unauthorized access to our pa",Technical / Online Access,High,Forward to technical support team,True,,The ticket will be forwarded to the technical support team for further action.
6523,"Issue with investment forecasts: Hello customer support, we are experiencing problems with our investment forecasts, which we suspect may be due to a ",Technical / Online Access,High,Request more information from customer,False,Could you provide more details about the specific problem you are encountering with the investment forecasts?,It is recommended to reach out to the customer to request additional details about the specific problem with the investment forecasts.
14923,"Guidance on Investment Analytics: Hello Customer Support, I am reaching out to inquire about optimizing investment analytics using Firebase and ClickU",Other,Low,Send standard FAQ or self-service link,True,,You can proceed with sending the relevant FAQ or self-service link to the customer.
14322,Concerns About Latest Invoices: Noted discrepancies in recent invoices due to apparent errors.,Billing / Payment,Medium,Request more information from customer,False,Can you please specify the discrepancies noted in the invoices?,"If you need further assistance, please let me know!"
9708,"Incident of Unauthorized Access in Healthcare System: An unauthorized access incident recently occurred in the healthcare system, which might have com",Technical / Online Access,High,Forward to technical support team,True,,The ticket will be forwarded to the technical support team for further investigation and resolution.
3651,"Query Regarding Sync Issues with Project Timelines: Hello customer service, I am encountering difficulties with project timelines not syncing across d",Technical / Online Access,Medium,Forward to technical support team,True,,The ticket will be forwarded to the technical support team for further handling.
18741,Problems with Network Connectivity: Several software applications are currently facing connectivity challenges.,Technical / Online Access,Medium,Request more information from customer,False,Can you please specify which software applications are facing connectivity challenges?,I will proceed to request more information from the customer regarding which software applications are facing connectivity challenges.
9310,Support for Smartsheet: Users are unable to sync project data with Smartsheet integrated devices due to recent software updates and network connectivi,Technical / Online Access,High,Forward to technical support team,True,,The ticket will be forwarded to the technical support team for resolution.
3748,": Customer Support, exploring digital strategies to enhance brand growth. Interested in detailed information on the topics you cover and the digital m",Other,Low,Send standard FAQ or self-service link,True,,"If you have any further actions or need additional information, please let me know!"
601,Enquiry on Data Security Measures for Hospital Products: I am seeking detailed information on the data security measures implemented for the services ,Technical / Online Access,Medium,Request more information from customer,True,,This ticket will be forwarded for the next steps.
8697,Assistance with Asana Integration for Data Analytics: I am contacting you to request support for integrating Asana with Redis 6.2 to enhance our inves,Technical / Online Access,Medium,Request more information from customer,True,,"Although the ticket is complete in terms of the request for support, additional specific details about the customer's current setup and any specific issues they might have encountered would help in providing a more tailored response. I will proceed to request that information from the customer."
17430,"Healthcare Provider System Data Breach: Data breach detected, potentially exposing patient information. The incident may have occurred due to outdated",Technical / Online Access,High,Forward to technical support team,True,,The ticket will be forwarded to the technical support team for immediate investigation and action regarding the data breach.
17242,": Customer Support, <br><br>I am reporting a critical bug that is preventing the project from syncing on the SaaS platform. The issue might have been ",Technical / Online Access,High,Forward to technical support team,True,,The ticket will be forwarded to the technical support team for urgent resolution.
9358,"Problem with Mesh Network Connectivity: Facing connectivity problems with the Mesh Network, which is impacting digital marketing efforts. The issue mi",Technical / Online Access,High,Forward to technical support team,True,,The ticket will be forwarded to the technical support team for resolution.
5564,": Facing sporadic service disruptions in our financial software, such as Xero and Sage Accounting. These outages might be due to recent system updates",Technical / Online Access,High,Forward to technical support team,True,,The ticket will be forwarded to the technical support team for further assistance.
7163,Trouble with Bose QuietComfort 35 II Gaming Headset Connectivity: We are encountering connectivity problems with the Bose QuietComfort 35 II Gaming He,Technical / Online Access,Medium,Forward to technical support team,True,,The ticket will be forwarded to the technical support team for further assistance with the connectivity issues related to the Bose QuietComfort 35 II Gaming Headset.
3069,Problem with Smartsheet Efficiency Today: Customers are facing performance challenges with CPU usage surges during project management activities. This,Technical / Online Access,High,Forward to technical support team,True,,The ticket will be forwarded to the technical support team for prompt resolution.
19566,"Refining Marketing Tactics: Customer Support,\n\nI am encountering difficulties with the marketing strategy. The marketing agency's digital strategies",Other,Medium,Request more information from customer,False,Could you specify what specific guidance you are seeking regarding marketing tactics?,You can proceed to ask the customer for more information regarding their needs in marketing tactics.
19891,": Customer Support,<br>Our marketing initiatives have slowed down due to inconsistent access to digital tools. This may have occurred due to recent up",Technical / Online Access,Medium,Forward to technical support team,True,,This ticket will be forwarded to the technical support team for further assistance with the access issues.
19150,Guidance on Optimizing Investment Analytics with Firebase and ClickUp: I am reaching out for assistance in optimizing investment analytics using Fireb,Other,Low,Send standard FAQ or self-service link,True,,The ticket will be handled by providing the customer with relevant self-service resources.
7915,Potential Security Breach in Medical Systems: A potential security breach has been identified in the medical data systems due to outdated encryption m,Technical / Online Access,High,Forward to technical support team,True,,The ticket will be processed accordingly.
18503,"Problem with Google Analytics: Hello Customer Support, I am contacting you regarding an issue we are facing with our website's analytics. The tracking",Technical / Online Access,High,Forward to technical support team,True,,The ticket will be forwarded to the technical support team for resolution.
19622,: Can you give more information on how Alteryx enhances investment optimization in data analytics? I am interested in learning about its capabilities.,Other,Low,Request more information from customer,False,Could you specify if you are looking for details related to a policy or insurance coverage?,Please follow up with the customer to clarify their request.
6766,"Problem with SaaS Platform Speed: Users encountered performance problems on the SaaS platform while managing project tasks, which might be related to ",Technical / Online Access,Medium,Request more information from customer,False,Can you provide more specific details about the performance problems or the products that are causing compatibility issues?,A clarification question has been noted to ask the customer for more specific details about the performance problems or the products causing compatibility issues.
5410,Problem with Reduction in Website Traffic: Our marketing agency has noticed a sudden decrease in website traffic. Efforts to address this issue have i,Technical / Online Access,Medium,Forward to technical support team,True,,The ticket will be routed to the technical support team for further investigation.
4267,Enhancing Investment Strategies for Financial Firms via Advanced Data Analytics Tools: Tools such as Tableau and Power BI prove beneficial,Other,Low,Request more information from customer,False,What specific assistance or information do you need regarding the data analytics tools?,Please follow up with the customer to clarify what specific assistance or information they need regarding the data analytics tools.
10622,"Concern Regarding Access to Medical Data: Hello Customer Support, I am contacting you to address an unexpected problem with access to my medical data.",Technical / Online Access,High,Forward to technical support team,True,,I will now proceed to forward this ticket to the technical support team for further assistance.
5375,Support for Integrating Tools for Enhanced Project Management: Could you assist me in integrating various tools for better project management and work,Other,Low,Send standard FAQ or self-service link,True,,This ticket will be routed accordingly.
9467,"Reported Crash During Google Keep Access: Experienced a system crash while using the Google Keep application on desktop computers, which might be due ",Technical / Online Access,Medium,Forward to technical support team,True,,The ticket will be forwarded to the technical support team for further handling.
6160,"Enhancing Security for Hospital Medical Data: Respected Customer Support, I am contacting you to seek advice on security measures for protecting medic",Technical / Online Access,Medium,Send standard FAQ or self-service link,True,,The ticket can proceed with sending a standard FAQ or self-service link related to security best practices for hospital IT infrastructure.
10495,User Interface Glitch Report: Description: Experienced a glitch with the user interface on the project dashboard. It may have occurred because of a re,Technical / Online Access,Medium,Forward to technical support team,True,,The ticket will be forwarded to the technical support team for resolution.
9182,Unforeseen Charges in My Account: I have encountered unexpected charges on several products.,Billing / Payment,Medium,Request more information from customer,False,Could you please specify which products have the unexpected charges?,It appears that the customer needs to specify which products have unexpected charges.
13055,: A financial firm is facing software incompatibility issues following a recent system update. Reinstalling and updating the software might resolve th,Technical / Online Access,Medium,Request more information from customer,False,Could you please provide details on any error messages and specify which software is experiencing compatibility issues?,Please proceed to ask the customer for more information regarding the error messages and the specific software that is facing compatibility issues.
18632,Problem with Investment Predictions Feature: I am contacting you to report an issue with the investment predictions feature. I noticed that the predic,Technical / Online Access,High,Forward to technical support team,True,,The ticket will be forwarded to the technical support team for further investigation and resolution of the issue with the investment predictions feature.
10467,"Issue with Integration: There was a sudden failure in the integration with ClickUp and Sage Accounting, which has disrupted our project management wor",Technical / Online Access,High,Forward to technical support team,True,,I will proceed to forward the ticket to the technical support team for resolution.
13965,Support Request for Adobe Creative Cloud Data Analytics Integration: I am contacting you to seek information on data analytics tools that can be integ,Other,Low,Send standard FAQ or self-service link,True,,This ticket will be routed to provide the customer with standard information or a self-service link related to their inquiry.
7796,Failed Product Purchases Due to Data Analytics Errors: I am experiencing issues with several purchase attempts failing because of data analytics error,Technical / Online Access,High,Forward to technical support team,True,,The ticket will be forwarded to the technical support team for further investigation and resolution.
14117,Troubleshooting Performance Problems in SaaS Project Management Software: The SaaS project management tool is encountering performance challenges attr,Technical / Online Access,High,Forward to technical support team,True,,The ticket will be routed to the technical support team for further assistance.
6610,Support on Security Measures for Medical Data: I am reaching out to customer support for guidance on security measures in place to protect sensitive p,Technical / Online Access,Medium,Forward to technical support team,True,,The ticket will be forwarded to the technical support team for further assistance.
7607,Issue with Data Analytics Dashboard Crash: Problem: The data analytics dashboard has crashed. Details: There was a sudden failure of the QuickBooks in,Technical / Online Access,High,Forward to technical support team,True,,The ticket will be forwarded to the technical support team for resolution.
5638,Unexplained Denial of Medical Information Today: Seek Assistance,Claims / Damage,High,Request more information from customer,False,What specific medical information was denied?,Please proceed to follow up with the customer for additional details regarding the denied medical information.
18653,"Issues with Digital Campaigns: Hello Customer Support, I am contacting you to address the poor performance of our digital campaigns. Despite being in ",Other,Medium,Send standard FAQ or self-service link,True,,The appropriate action is to provide the customer with standard FAQs or self-service links that may help them with their inquiries regarding digital campaign performance.
17148,": Dear Customer Support, I am reporting a critical performance degradation noticed during peak usage hours. The issue might be due to server resource ",Technical / Online Access,High,Forward to technical support team,True,,The ticket will now be forwarded to the appropriate technical support team to address the reported performance degradation.
6043,Guidance on Integrating Projektor Tools: I am contacting you to inquire about the optimal strategies for integrating Projektor with Notion and Adobe S,Other,Low,Send standard FAQ or self-service link,True,,I will now proceed to send the customer a standard FAQ or self-service link.
15473,Complete Failure of Project Synchronization Today: Project synchronization across platforms has failed due to incompatible API updates.,Technical / Online Access,High,Forward to technical support team,True,,The ticket will be forwarded to the technical support team for resolution.
15916,"Concerns About Investment Metrics: Noticing inaccuracies in the reported investment performance metrics, which might be due to recent data integration",Technical / Online Access,High,Forward to technical support team,True,,"If there is anything else you need, feel free to ask!"
1334,Hospital Systems Security Breach Detected: security issue identified in hospital systems,Technical / Online Access,High,Request more information from customer,False,Could you please provide more details regarding the specific security issue identified?,A request for more information will be sent to the customer regarding the specific security issue identified in the hospital systems.
11365,"Request for Integration Guidance Between Google Cloud Platform and ClickUp: Hello customer support, I am contacting you to seek advice on enhancing th",Other,Low,Send standard FAQ or self-service link,True,,This ticket will be forwarded to the relevant resources for assistance with the integration query.
13096,"Analysis of System Malfunction: Customer Support, <br>We are encountering system failure while processing historical investment data. The issue might ",Technical / Online Access,High,Forward to technical support team,True,,This ticket will be forwarded to the technical support team for prompt assistance.
7482,"Security Incident in Hospital System: A security breach has been detected in the hospital's system, potentially compromising medical data. This may ha",Technical / Online Access,High,Forward to technical support team,True,,This ticket will be forwarded to the technical support team for immediate attention regarding the security incident.
7846,Exploring Data Analytics Tools for QuickBooks Online Integration: I am contacting you to learn about data analytics tools that can be integrated with ,Other,Low,Request more information from customer,False,Can you specify what specific investment areas you seek to optimize?,"If you need to follow up or require any adjustments, please let me know!"
6998,Request for Secure Management of Medical Data in Hospital Systems Using Debian 10 Buster: Please provide comprehensive information on securing medical,Technical / Online Access,Medium,Forward to technical support team,True,,The ticket will be forwarded to the technical support team for further handling.
13586,Support for Analytics Tool: We are experiencing inconsistent results with the data analytics tool designed for investment optimization. This might be ,Technical / Online Access,High,Forward to technical support team,True,,The ticket will be forwarded to the technical support team for assistance with the issues related to the analytics tool.
15342,"Query on Billing Options for Elasticsearch Integration with Xero and Microsoft Products: Greetings Customer Support, I am writing to seek information ",Billing / Payment,Medium,Forward to billing team,True,,The ticket will be routed to the billing team for further assistance regarding the queries on billing options for the Elasticsearch integration.
3141,"Medical Data Breach Event: Hello Customer Support, <br><br>I am contacting you to report a medical data breach that happened during the night. This br",Technical / Online Access,High,Forward to technical support team,True,,The ticket will be forwarded to the technical support team for further assistance.
1315,"Critical Incident: Medical Information Exposed by Unsecured Access: Hello Customer Support, <br><br>I am reaching out to report a significant problem ",Technical / Online Access,High,Forward to technical support team,True,,The ticket will be forwarded to the technical support team for immediate assistance on the critical issue of unsecured medical information exposure.
572,Request for Xero Integration Details: I am contacting you to seek information regarding integration options for Xero with your project management SaaS,Other,Low,Send standard FAQ or self-service link,True,,This ticket will be routed accordingly.
