ticket_id,text_snippet,topic,urgency,next_action,is_complete,clarification_question,notes
15351,"Inquiry on Data Analytics Tools for Investment: Customer Support, I am reaching out to inquire about data analytics tools that can optimize investment",Other,Low,Send standard FAQ or self-service link,True,,"This ticket does not fall under usual insurance topics, and it will be handled by providing available resources and information."
19810,Enhancement of Investment Strategies: Request for evaluation and optimization of investment strategies utilizing data analytics tools. We aim to ident,Other,Medium,Send standard FAQ or self-service link,True,,"This ticket is not related to an insurance product but rather an enhancement request, hence classified under ""Other"". It's complete and requires a standard response regarding FAQs or potentially a self-service resource."
15924,"Request for Social Media Assistance: We have observed a sudden decrease in social media engagement. Despite adjusting posting times and content types,",Other,Low,Send standard FAQ or self-service link,True,,"If you need further assistance, please let me know!"
10128,"Problem with Document Scanning: The scanner is not functioning properly and is unable to upload medical records. I have tried restarting the scanner, ",Technical / Online Access,Medium,Forward to technical support team,True,,"- **Topic**: Classified as **Technical / Online Access**.
- **Urgency**: Scored as **Medium**.
- **Completeness**: The ticket is complete with no need for additional information.
- **Next Action**: Forwarded to the **technical support team**."
12300,Support Required for Billing Issue: I am reaching out to address a billing concern related to my data analytics services. I've been charged twice on m,Billing / Payment,Medium,Forward to billing team,True,,I will now proceed to forward this ticket to the billing team for further investigation and resolution.
13723,"Enhancing Brand Growth Through Magento and Elasticsearch Integration: Hello Customer Support, I am contacting you to explore the digital strategies th",Other,Low,Send standard FAQ or self-service link,True,,You can proceed with sending the standard FAQ or directing the customer to relevant self-service resources regarding Magento and Elasticsearch integration.
1147,"Support for Integrating Ulysses with MySQL: Hello, we are reaching out for detailed guidance on integrating Ulysses with MySQL for our project managem",Technical / Online Access,Medium,Forward to technical support team,True,,The ticket has been routed to the appropriate team for further assistance.
11766,"Security Practices for Medical Data Custody and Distribution: Hello Customer Support, I am contacting you to seek information on the security practice",Technical / Online Access,Medium,Send standard FAQ or self-service link,True,,"Since the topic relates to technical security practices for medical data, it will be routed accordingly and the customer will receive relevant information based on standard FAQs or self-service options."
17218,"SaaS Sync Suddenly Stopped Today: Hello Customer Support, I am contacting you to inform you about a problem I am experiencing with our SaaS sync, whic",Technical / Online Access,High,Forward to technical support team,True,,The ticket will be forwarded to the technical support team for prompt attention.
10408,": To the customer support team,\n\nI am contacting you to report a potential medical data breach. The breach happened due to an unsecured Google Meet ",Technical / Online Access,High,Forward to technical support team,True,,The ticket will be forwarded to the technical support team for further investigation and resolution.
15694,Support for Marketing Strategy: Marketing strategies have not achieved the anticipated brand growth. The latest digital campaigns have not enhanced en,Other,Medium,Request more information from customer,True,,"This ticket is categorized under ""Other"" because it does not fit into the typical insurance-related topics. It has a medium urgency score, indicating that while it is not critical, it does require attention. The ticket is complete, so the next action is to request more information from the customer to better address their marketing strategy concerns."
15153,"System Downtime Problem: Hello Customer Support, I am writing to report an unexpected system downtime that occurred during data analysis queries, whic",Technical / Online Access,High,Forward to technical support team,True,,This issue will be forwarded to the technical support team for resolution.
13585,Unexpected Issues with Data Encryption Today: The encryption process encountered problems. It might be due to an old software update.,Technical / Online Access,High,Request more information from customer,False,Could you provide more details on the specific issues encountered during the encryption process?,I will now send a follow-up request to the customer for more details on the specific issues encountered during the encryption process.
14626,Interference in various applications due to system overburden: Encountering a problem with server overload,Technical / Online Access,High,Request more information from customer,False,Could you provide more details about the specific applications affected by the server overload?,I will be reaching out to the customer to request additional details on the specific applications affected by the server overload.
742,Identified Problems with Airtable Synchronization: Faced synchronization difficulties between Airtable and Cassandra 4.0,Technical / Online Access,Medium,Request more information from customer,False,Can you please provide more details about the specific issues encountered during synchronization?,The next step is to reach out to the customer for further details regarding the synchronization issues they are experiencing.
9784,Assistance with Detected Security Breach: Noted unauthorized access attempts on the medical data system due to outdated security protocols. After revi,Technical / Online Access,High,Forward to technical support team,True,,The ticket will be forwarded to the technical support team for further assistance.
11028,Enhancing Insights from Xero Data Analytics: Supply guidance for investment strategies,Other,Low,Request more information from customer,False,Could you please provide more details on what specific insights or guidance you are seeking?,Please reach out to the customer for more specific details regarding the insights or guidance they are seeking on investment strategies.
15601,Issue with recent system update causing software incompatibility: We regret the inconvenience caused by the software incompatibility issues following ,Technical / Online Access,Medium,Request more information from customer,False,"Could you please provide details of any error messages you are seeing, specifically related to the software experiencing compatibility issues?","You should proceed to request additional information from the customer, asking them to provide details of any error messages related to the software experiencing compatibility issues."
12680,Concern about Unauthorized Access Attempts on Medical Data: Experienced unauthorized access attempts on medical data. Despite implementing firewall ad,Technical / Online Access,High,Forward to technical support team,True,,This ticket will be forwarded to the technical support team for further investigation and resolution.
10366,"Login Problem Encountered: On Friday, there was a login complication. It might have been due to an old browser cache. Tried: Cleaned cache and restart",Technical / Online Access,Medium,Forward to technical support team,True,,The ticket will be forwarded to the technical support team for further assistance.
1508,"Insights into Project Management SaaS Scalability: Seeking detailed information on project management SaaS offerings, particularly regarding their fea",Other,Low,Send standard FAQ or self-service link,True,,This ticket will be addressed by providing the customer with relevant resources.
10753,"Problem with Smart-Medizinspender Data Synchronization: Smart-Medizinspender is not able to sync data with Zoho Books, leading to delays in project up",Technical / Online Access,Medium,Forward to technical support team,True,,The ticket will be forwarded to the technical support team for assistance.
9788,"Hospital Security Breach Incident: Recently, sensitive patient information was exposed due to a potential security breach in the hospital's systems. T",Technical / Online Access,High,Forward to technical support team,True,,The ticket will now be forwarded to the technical support team for further action.
11498,Boosting Brand Growth Through Digital Strategies: Is it possible to get details on how digital strategies can enhance brand growth for a marketing age,Other,Low,Request more information from customer,False,Could you specify your inquiry regarding digital strategies and brand growth?,Please proceed with requesting more information from the customer.
8487,"Concerns Regarding Project Synchronization: Hello Customer Support, I hope this message finds you well. I am reaching out to inform you about a synchr",Technical / Online Access,Medium,Forward to technical support team,True,,The ticket will be forwarded to the technical support team for further investigation and resolution.
17856,"Request for QNAP TS-453D NAS Data Security: Dear Support Team, I am writing to inquire about securing medical data on my QNAP TS-453D NAS. My user dev",Technical / Online Access,Medium,Forward to technical support team,True,,The ticket will be forwarded to the technical support team for further assistance.
3751,Health Information Leak: The Smart-Thermometer application was compromised because of inadequate encryption measures.,Technical / Online Access,High,Request more information from customer,False,Could you please provide more details about the specific issue you encountered and any impacts it has caused?,The ticket is prioritized for further clarification regarding the health information leak issue before taking additional steps.
3423,: The financial firm's data analytics tools are experiencing malfunctions. These issues might be due to compatibility problems arising from recent sof,Technical / Online Access,High,Forward to technical support team,True,,The ticket will be forwarded to the technical support team for further assistance.
7301,": Dear Customer Support, we are encountering data integration challenges between our analytics tools, which is impacting our investment optimization e",Technical / Online Access,Medium,Request more information from customer,False,What specific guidance or troubleshooting steps are you looking for regarding the data integration challenges?,You should reach out to the customer to clarify what specific guidance or troubleshooting steps they are looking for regarding the data integration challenges.
14712,Investment Dashboard Failed to Load: I am unable to load the investment dashboard. It seems there might be an issue with software compatibility due to,Technical / Online Access,Medium,Forward to technical support team,True,,The ticket will be forwarded to the technical support team for further assistance with the investment dashboard issue.
15366,Concern about Security in Hospital System: An unexpected data breach has been detected in the hospital's system. The issue might be due to outdated se,Technical / Online Access,High,Forward to technical support team,True,,The ticket will be forwarded to the technical support team for further action.
10555,"Unexplained Absence of Digital Campaign Metrics Today: Greetings Customer Support, I am inquiring about a recent issue with our digital campaign metri",Technical / Online Access,High,Forward to technical support team,True,,The ticket will be routed to the appropriate technical support team for resolution.
11595,"Query on Integrating Data Analytics with Investment Software for Portfolio Management: Hello Customer Support, I am contacting you to request assistan",Other,Low,Send standard FAQ or self-service link,True,,You can proceed by sending the customer a standard FAQ or self-service link related to the integration of data analytics with investment software.
6990,": Respected customer support, I am keen to explore your digital strategies for enhancing brand growth and development services. Could you kindly furni",Other,Low,Send standard FAQ or self-service link,True,,The ticket will be handled by sending a standard FAQ or self-service link related to the requested information.
8667,"Recurring Disruptions in Software During Peak Traffic Times: During peak traffic hours, users frequently encounter disconnections. Despite optimizing ",Technical / Online Access,High,Forward to technical support team,True,,The ticket will be directed to the relevant technical support team for further assistance.
6462,Report on Sudden Project Data Loss: There was an unexpected loss of project data recently. It might be related to a database synchronization problem. ,Technical / Online Access,High,Forward to technical support team,True,,The ticket will be routed to the appropriate team for resolution.
15490,Latest Project Management SaaS Enhancements: Would like to know about the latest updates and features in project management SaaS. I am eager to learn ,Other,Low,Send standard FAQ or self-service link,True,,This ticket will be handled by sending the customer a standard FAQ or self-service link to address their inquiry about the latest updates and features in project management SaaS.
11940,"Details on Project Management Features: Is there any information on the SaaS features, pricing plans, and project management tools available? Thank yo",Other,Low,Request more information from customer,False,What specific information are you looking for regarding project management features?,Would you like to proceed with sending a clarification request to the customer?
8477,Notify about Unapproved Access: There have been reported unauthorized access attempts to medical data. Potential reasons could be weak security measur,Technical / Online Access,High,Forward to technical support team,True,,This ticket regarding unauthorized access attempts will be forwarded to the technical support team for further investigation.
1665,: reporting on frequent application crashes and user authentication issues. Recent backend server updates and configuration changes could be the cause,Technical / Online Access,High,Forward to technical support team,True,,This ticket will be forwarded to the technical support team for immediate assistance.
3802,"Concerns Regarding Security of Medical Data: Hello Customer Support, I am encountering a security issue with medical data access. After a routine syst",Technical / Online Access,High,Forward to technical support team,True,,The ticket will be forwarded to the technical support team for resolution.
14215,Finding on Inaccuracy in Investment Forecasts: Incident: Investment forecasts diverged from anticipated results. Likely reasons: Potential lack of ade,Other,Medium,Send standard FAQ or self-service link,True,,"If you need further assistance, feel free to ask!"
3102,Issues with Investment Analytics Reports: Noted inconsistencies in the investment analytics reports which have led to incorrect investment recommendat,Technical / Online Access,High,Forward to technical support team,True,,I will proceed to forward this ticket to the technical support team.
6708,"Facing Service Interruptions in Digital Marketing Software: Digital marketing tools, such as Canvas and DaVinci Resolve, are currently experiencing ou",Technical / Online Access,High,Forward to technical support team,True,,The issue of service interruptions in the digital marketing software will be forwarded to the appropriate team for resolution.
5867,Moodle integration issue caused by synchronization error following plugin update: We're encountering a problem with Moodle integration that seems to b,Technical / Online Access,High,Forward to technical support team,True,,I will proceed to forward this ticket to the technical support team for resolution.
14929,"Data Breach in Patient Records Identified: Dear Customer Support, \nA data breach has been discovered, jeopardizing patient records due to a suspected",Technical / Online Access,High,Forward to technical support team,True,,The technical support team will be notified to address the urgent issue regarding the data breach in patient records.
16224,"Report on an Incident Involving Data Security Breach: Dear Customer Support,\n\nI am contacting you to report a significant issue with the accidental ",Technical / Online Access,High,Forward to technical support team,True,,The ticket will be forwarded to the technical support team for further handling.
455,"Inquiry on Pricing for WooCommerce Integration: Hello customer support, I am reaching out to seek information on the pricing for WooCommerce integrati",Other,Low,Send standard FAQ or self-service link,True,,The ticket will now be handled by sending the customer a standard FAQ or self-service link regarding WooCommerce integration pricing information.
4472,": Dear Customer Support, we are exploring digital strategies to enhance our brand growth and are interested in gaining information on methods and tech",Other,Low,Send standard FAQ or self-service link,True,,This ticket will be handled by providing a standard FAQ or self-service link related to digital marketing and customer engagement.
5005,": Dear Customer Support, I am contacting you to seek advice on digital strategies that can help drive brand growth for our marketing agency. We aim to",Other,Low,Send standard FAQ or self-service link,True,,"If you have any further instructions or need additional assistance, please let me know!"
3299,Healthcare Data Protection: I require help in improving the security of medical information by implementing robust encryption. This data is stored acr,Technical / Online Access,High,Request more information from customer,False,Could you specify the types of systems and devices involved?,I will proceed to request more information from the customer regarding the specifics of the systems and devices involved.
12233,Available Training Options for New Hire Orientation: Could you please inform me about the different training options that are part of the new hire ori,Other,Low,Send standard FAQ or self-service link,True,,This action will be taken accordingly to provide the customer with the requested information about training options available.
15445,"Improve Digital Strategy Tools Across Various Platforms: Customer Support, requesting enhancements to digital strategy tools to boost brand growth int",Other,Medium,Send standard FAQ or self-service link,True,,"The ticket will be handled by sending a standard FAQ or self-service link, as it does not fit other specific categories and is not of high urgency."
7655,"Performance Issues: Hello customer support, I am experiencing a performance slowdown in my data analytics system, which I believe could be due to high",Technical / Online Access,High,Forward to technical support team,True,,The ticket will be forwarded to the technical support team for further assistance.
16095,"Customer Support Brand: Seeking effective methods to enhance brand growth through Adobe Creative Cloud. Would appreciate detailed insights, tools, and",Other,Low,Send standard FAQ or self-service link,True,,Proceeding with sending the standard FAQ or self-service link to the customer.
2795,Investment Optimization Models Failed Unexpectedly Last Night: The investment optimization models unexpectedly stopped working last night possibly due,Technical / Online Access,High,Forward to technical support team,True,,"- **Topic**: Technical / Online Access
- **Urgency**: High
- **Completeness**: Complete
- **Next Action**: Forward to technical support team"
3722,Problem Accessing Medical Records: Access to medical records was denied and the system experienced slow performance. This might be due to recent softw,Technical / Online Access,High,Forward to technical support team,True,,The ticket will be routed to the technical support team for further assistance.
236,"Unforeseen Costs on My Subscription Plan This Day: Respected Customer Support Team, I am contacting you about a problem that has arisen with my subscr",Billing / Payment,High,Request more information from customer,False,Could you please provide more specific details about the charges that you are seeing?,This ticket should now be handled by requesting additional details from the customer regarding the specific charges they are seeing.
1896,Problems with System Updates: Faced connectivity issues and software malfunctions.,Technical / Online Access,High,Request more information from customer,False,Can you provide more details about the specific connectivity issues and software malfunctions?,I will reach out to the customer to request more details about the specific connectivity issues and software malfunctions they are experiencing.
13235,"Concern Regarding Data Analytics Integration: We are facing an integration issue that has disrupted our data analytics processes, particularly affecti",Technical / Online Access,High,Forward to technical support team,True,,This ticket will be forwarded to the technical support team for resolution.
8575,Boost Investment Analysis Using AI Tools: I would like to learn more about utilizing AI-driven portfolio optimization with H2O.ai to enhance investmen,Other,Low,Send standard FAQ or self-service link,True,,You can proceed with the identified action.
17636,Inquiry for Digital Strategy Guidance and Cost Information: Kindly furnish us with details regarding the consultation and pricing.,Other,Low,Request more information from customer,False,Could you please specify what type of digital strategy guidance you are looking for?,The next step is to reach out to the customer and ask for more information regarding the specific type of digital strategy guidance they need.
3131,Enquiry on Data Analytics Tools for Investment Portfolio Optimization: I am contacting you to seek information on data analytics tools that can be use,Other,Low,Send standard FAQ or self-service link,True,,The next action is to send a standard FAQ or self-service link to the customer regarding data analytics tools.
5834,"Data Breach in Medical Records Storage: A data breach has been identified where medical records were stored in Docker. Despite secure settings, issues",Technical / Online Access,High,Forward to technical support team,True,,The ticket will be forwarded to the technical support team for further investigation and action on the data breach issue.
10353,"Technical Support Concerns: Customers are facing connectivity challenges on various devices and applications, which is disrupting project processes. T",Technical / Online Access,High,Forward to technical support team,True,,The ticket will be forwarded to the technical support team for further assistance.
5924,"Assistance with Data Breach: A data breach has been detected, which may have compromised sensitive medical information. It potentially occurred due to",Technical / Online Access,High,Forward to technical support team,True,,The ticket will be forwarded to the technical support team for further action.
1734,Technical Support for Financial Data Analytics Tool Malfunction: The Financial Data Analytics Tool has failed to optimize investment returns due to a ,Technical / Online Access,High,Forward to technical support team,True,,The ticket will be forwarded to the technical support team for resolution.
2064,"Strategies for Safeguarding Medical Information: Hello Customer Service, I am reaching out to seek advice on the best security practices for safeguard",Technical / Online Access,Medium,Send standard FAQ or self-service link,True,,This ticket will be responded to with a standard FAQ or a self-service link that provides information on security practices for safeguarding medical information.
8198,Problem with AR Brille: Description: AR-Brille integration has failed. Reason: Incompatible firmware update might be the cause. Efforts: Restarted the,Technical / Online Access,High,Forward to technical support team,True,,The ticket will be forwarded to the technical support team for further assistance.
13290,"Enhancements to Investment Portfolio Analysis Tool: Dear Customer Support, I am contacting you to propose improvements to the investment portfolio ana",Other,Low,Send standard FAQ or self-service link,True,,"If you need any further assistance, please let me know!"
9590,Boosting Brand Growth for Tech Products: Which digital strategies are most effective for driving brand growth in tech products? I require assistance w,Other,Low,Request more information from customer,False,Could you specify the specific assistance or information you are looking for regarding brand growth strategies?,A request for more information has been initiated.
13368,": Respected Customer Support Team, I hope this message finds you well. I am contacting you to seek detailed insights into the digital marketing techni",Other,Low,Send standard FAQ or self-service link,True,,This ticket will be forwarded to the appropriate resources for a standard FAQ or self-service link.
4775,Digital campaigns failed to launch on schedule: The campaigns failed because of incompatible updates.,Technical / Online Access,High,Request more information from customer,False,What specific updates are incompatible that caused the campaigns to fail?,I will proceed to request more information from the customer regarding the specific updates that are incompatible and caused the campaigns to fail.
