ticket_id,text_snippet,topic,urgency,next_action,is_complete,clarification_question,notes
13761,"Inquiry on Recommended Security Protocols for Avast Free Antivirus in Hospital Settings: Respected customer service, could you provide advice on the s",Technical / Online Access,Medium,Send standard FAQ or self-service link,True,,The ticket will be handled by providing the customer with relevant security measures for using Avast Free Antivirus in a hospital environment.
8059,"Issue with Billing for Analytical Services: Hello, I am writing to address the discrepancies I found in my billing statement for analytical services. ",Billing / Payment,Medium,Forward to billing team,True,,The ticket will be forwarded to the billing team for further action.
3482,Inquiry on Integrating Project Management Tools: Seeking details on integrating project management tools through API capabilities. Would greatly appre,Technical / Online Access,Medium,Forward to technical support team,True,,The ticket will be forwarded to the appropriate technical support team for further handling.
16640,"Problem Encountered During Medical Data Transfer: To the support team, here is a brief summary of the issue: Problem: Medical data failed to transfer ",Technical / Online Access,Medium,Forward to technical support team,True,,The ticket will be forwarded to the technical support team for further assistance.
14254,Request for Support with IBM SPSS Statistics 28: I am seeking guidance on how to optimize data analytics and investment decisions using IBM SPSS Stati,Technical / Online Access,Medium,Forward to technical support team,True,,The ticket will be forwarded to the technical support team for assistance with IBM SPSS Statistics 28.
15367,"Inquiry on Integration Options for Mini-Beamer with Project Management SaaS: Hello Customer Support Team, I am reaching out to request details on the ",Other,Low,Send standard FAQ or self-service link,True,,The appropriate action is to send a standard FAQ or self-service link regarding integration options and resources.
14631,"Security Protocols for Healthcare on Discord: Hello Customer Support, I am writing to seek advice on the security protocols that should be followed wh",Technical / Online Access,Medium,Send standard FAQ or self-service link,True,,The customer will receive appropriate guidance on security protocols for using Discord in a healthcare environment.
6735,"Report on Sudden Drop in Online Engagement: Customer Support, we are reporting a sudden drop in online engagement for our brand visibility. This issue",Other,Medium,Request more information from customer,False,Could you please specify the type of assistance or guidance you are seeking?,The ticket will therefore be handled by requesting additional information from the customer regarding the specific type of assistance they are seeking.
150,Problem with Data Analytics: The data analytics dashboard did not update during the night because of insufficient NAS storage or possible AWS connecti,Technical / Online Access,High,Forward to technical support team,True,,The ticket will be forwarded to the technical support team for further assistance.
13645,Support for Kodak ScanMate: Is it possible to get comprehensive details on integrating the Kodak ScanMate i940 project management SaaS solution? This ,Technical / Online Access,Medium,Forward to technical support team,True,,The ticket will be forwarded to the technical support team for further assistance.
17562,Issue with Project Timeline Rendering: There has been an unexpected error encountered while rendering the project timeline.,Technical / Online Access,Medium,Request more information from customer,False,Can you provide more details about the error encountered while rendering the project timeline?,The customer will need to provide more details about the error to proceed further.
13448,Challenge in Implementing Digital Strategy Owing to Software Updates: The marketing agency encountered connectivity problems that hindered the executi,Technical / Online Access,High,Forward to technical support team,True,,This ticket will be forwarded to the technical support team for further assistance.
4010,Information on Data Analytics Tools Compatible with Kubernetes: Greetings from customer support. I hope this message finds you well. I am interested i,Other,Low,Send standard FAQ or self-service link,True,,This ticket will be routed to resources that can provide information on data analytics tools.
4986,"System Requirements for Integrating Terraform: Greeting from Customer Support, I am contacting you to seek information about the system requirements n",Technical / Online Access,Medium,Request more information from customer,False,Could you specify the exact environment or context in which you plan to integrate Terraform?,I will proceed to request clarification from the customer regarding the integration environment or context.
5188,"Issues with Campaign Metrics Tracking: There is a discrepancy in the campaign metrics between Canvas and ActiveCampaign, which could be due to an API ",Technical / Online Access,Medium,Forward to technical support team,True,,The ticket will be forwarded to the technical support team for assistance.
10877,"Investment Data Analytics Dashboard Encountered an Unexpected Crash Today: The dashboard experienced a sudden crash, which might be linked to outdated",Technical / Online Access,High,Forward to technical support team,True,,This ticket will be forwarded to the technical support team for further assistance with the dashboard crash issue.
15617,Boost Data Analytics Integration with Redis and QuickBooks: I am contacting you to seek information on improving data analytics integration with Redis,Other,Low,Request more information from customer,False,Could you please specify what specific information or guidance you are looking for related to this integration?,"The clarification question to ask is: ""Could you please specify what specific information or guidance you are looking for related to this integration?"""
10879,Problem with Software Crashes in Steinberg Cubase 11 and Adobe Premiere Pro 2021: Facing software crashes with Steinberg Cubase 11 and Adobe Premiere ,Technical / Online Access,Medium,Forward to technical support team,True,,The ticket will now be forwarded to the technical support team for further assistance.
564,"Detected Security Breach in Hospital System: Customer Support,<br>A security breach has been detected in the hospital system, impacting medical data. ",Technical / Online Access,High,Forward to technical support team,True,,I will proceed to forward this ticket to the technical support team for immediate assistance.
4999,"Enquiry into Payment Methods for Mailchimp Services: Respected customer support team, I am writing to seek information about the payment methods that ",Billing / Payment,Medium,Send standard FAQ or self-service link,True,,The next step is to provide the customer with a standard FAQ or self-service link related to payment methods.
12238,"Problem with Data Analytics Dashboard Freezing Unexpectedly Today: The data analytics dashboard has frozen, with visualizations ceasing to update abru",Technical / Online Access,High,Forward to technical support team,True,,The ticket will be forwarded to the appropriate technical support team for further assistance.
7560,Concern About Medical Data Transmission: There has been an interruption in the medical data transmission. It may be related to a network configuration,Technical / Online Access,High,Forward to technical support team,True,,The ticket will be forwarded to the technical support team for further assistance.
8945,Inquiry on Integrations with Investment Analytics Tools: I am contacting you to seek information about the integrations available between Zapier and i,Other,Low,Send standard FAQ or self-service link,True,,This ticket will be handled by providing the customer with relevant FAQs or self-service resources regarding integrations with investment analytics tools.
10011,Optimization of Investment Portfolios: Could you give details on how to optimize investment portfolios with data analytics services?,Other,Low,Request more information from customer,False,Could you specify whether you are inquiring about insurance-related investment portfolios or a different type?,The next action is to request more information from the customer.
6571,"Inquiry About Shopify Integrations for Digital Marketing: Hello, I am writing to inquire about the integrations that support Shopify for digital marke",Other,Low,Send standard FAQ or self-service link,True,,This ticket will be processed accordingly.
148,Support for SQL Server: Could you provide documentation on integrating SQL Server with data analytics tools? I am looking for guides and tutorials to ,Other,Low,Send standard FAQ or self-service link,True,,This ticket will be addressed accordingly by sending a standard FAQ or self-service link.
9183,Enhance Data Analytics Equipment: Improve investment and security software for enhanced performance and constant safety.,Technical / Online Access,Medium,Request more information from customer,False,Could you please provide more details about the specific improvements or issues you are experiencing with the data analytics equipment?,I will go ahead and request more details about the specific improvements or issues the customer is experiencing with the data analytics equipment.
10336,Unanticipated Data Access Issue with Ulysses DeepL Patient Records: An unanticipated data access error occurred while using Ulysses DeepL patient reco,Technical / Online Access,High,Forward to technical support team,True,,The ticket will be forwarded to the technical support team for further assistance.
10385,Unapproved Access Incidents Involving Medical Data Detected: A healthcare organization has encountered unapproved access incidents involving medical d,Technical / Online Access,High,Forward to technical support team,True,,The ticket will be forwarded to the appropriate team for handling.
12474,": Regarding the report on the data breach in the hospital's system where sensitive medical data was compromised, it seems the breach might have occurr",Technical / Online Access,High,Forward to technical support team,True,,I will now proceed to forward this ticket to the technical support team.
7013,Ensuring Safe Medical Data Security: Requesting guidance on securing medical data. Could you provide information on how to protect sensitive medical i,Technical / Online Access,Medium,Send standard FAQ or self-service link,True,,This ticket will be handled by sending a standard FAQ or self-service link related to securing medical data.
11709,"Support Required for Investment Analysis Tool: Customer Support, <br>I am writing to report an issue with the investment analysis tool. The tool is ge",Technical / Online Access,High,Forward to technical support team,True,,The ticket will be forwarded to the technical support team for urgent assistance with the investment analysis tool issue.
3263,"Random Freezing of SaaS Platform: The SaaS platform randomly freezes, especially during peak usage times. This might be related to server overload. Se",Technical / Online Access,High,Forward to technical support team,True,,The ticket will be forwarded to the technical support team for further investigation and resolution.
942,"Problem with Investment Analytics System: Customer Support, <br> We are currently facing a critical issue with the investment analytics tools. The sys",Technical / Online Access,High,Forward to technical support team,True,,This ticket is being forwarded to the technical support team for prompt resolution.
582,Enhancing Digital Brand Growth Strategies: May we offer insights to optimize your digital strategies?,Other,Low,Request more information from customer,False,Could you please specify the type of digital strategies you are seeking insights on?,"The clarification question to be asked is: ""Could you please specify the type of digital strategies you are seeking insights on?"""
19976,Improve Investment Portfolio with Machine Learning: I would like to explore using machine learning algorithms to optimize my investment portfolio for ,Other,Low,Send standard FAQ or self-service link,True,,This ticket will be forwarded to the appropriate resources for further information related to improving investment portfolios with machine learning.
17616,Improve security in medical data management systems: Request to implement enhanced security measures for medical data management integration within ho,Technical / Online Access,High,Forward to technical support team,True,,The ticket will be forwarded to the technical support team for further action.
19115,Query Regarding Data Analytics Services: Is it possible to get details about data analytics services?,Other,Low,Request more information from customer,False,What specific information are you looking for regarding data analytics services?,The customer should be asked for more details regarding their inquiry about data analytics services.
6582,"Identified Data Breach Endangering Patient Information: A data breach has been detected, resulting in the exposure of patient records through unauthor",Technical / Online Access,High,Forward to technical support team,True,,This ticket will be routed to the technical support team for immediate assistance.
8652,Problem With Subscription Costs: I am encountering unanticipated charges across several subscription services. Despite reaching out to the support tea,Billing / Payment,High,Forward to billing team,True,,I will proceed to forward this ticket to the billing team for resolution.
14808,"Problem with Payment Gateway: Customers are unable to complete transactions, which is affecting the billing of various products. This issue might be d",Technical / Online Access,High,Forward to technical support team,True,,This ticket will be forwarded to the technical support team for resolution.
8809,: Could you furnish more information on digital strategies for brand growth? I aim to enhance my online presence and reach a broader audience. I would,Other,Low,Send standard FAQ or self-service link,True,,This ticket will be routed to provide the customer with relevant resources.
15388,"Project data vanished unexpectedly during the night. Possibly related to database synchronization. Attempted to restart the application, examined back",Technical / Online Access,High,Forward to technical support team,True,,I will proceed to forward the ticket to the technical support team for further assistance.
6330,: Could you please provide more information on data analytics services for investment optimization? Your timely assistance is important to us.,Other,Medium,Request more information from customer,False,Could you specify what specific information you are looking for regarding data analytics services?,"- **Topic**: Other
- **Urgency**: Medium
- **Completeness**: Incomplete (Clarification question: ""Could you specify what specific information you are looking for regarding data analytics services?"")
- **Next Action**: Request more information from the customer."
8833,"Integrate Smart Devices: Hello customer support, I am contacting you to seek advice on integrating Smart-Thermometer and Smart-Thermostat data into ou",Other,Low,Send standard FAQ or self-service link,True,,The next action will be to send a standard FAQ or self-service link to assist the customer with their inquiry regarding the integration of smart devices into their project management software.
5784,Inquiry About Digital Strategy Services Payment Terms: I am writing to get details regarding the payment terms for digital strategy services. Could yo,Billing / Payment,Medium,Forward to billing team,True,,This ticket will be forwarded to the billing team for further assistance.
5460,Improve Document Management Features: Request to integrate Adobe Sign and Grammarly into the project management platform. This integration will stream,Other,Medium,Send standard FAQ or self-service link,True,,The ticket will be processed according to these classifications and decisions.
10869,"Investment Analysis Dashboard Problem: Please find below a brief description of the issue: The investment analysis dashboard has not loaded, which may",Technical / Online Access,Medium,Forward to technical support team,True,,"If you need any further assistance, feel free to ask!"
16662,"Issues with Investment Forecast Reports: Hello Customer Support, I am encountering problems with the data analytics tools. The investment forecasts se",Technical / Online Access,High,Forward to technical support team,True,,I will now proceed to forward this ticket to the technical support team for resolution.
187,Inquiry on Digital Strategies for Brand Growth: We are seeking information on digital strategies to enhance brand growth. Could you provide detailed m,Other,Low,Send standard FAQ or self-service link,True,,The ticket will be routed to provide the customer with relevant information on digital strategies for brand growth.
18446,"Problems with Asana Synchronization: I am currently facing difficulties with syncing my Asana tasks, which might be due to a conflict with the API. De",Technical / Online Access,Medium,Forward to technical support team,True,,The ticket will be forwarded to the appropriate technical support team for assistance.
18731,Sudden Medical Data Breach Due to Insufficient Encryption and Outdated Oracle Database: A medical data breach happened unexpectedly because of inadequ,Technical / Online Access,High,Forward to technical support team,True,,The ticket will be forwarded to the technical support team for urgent resolution.
12401,"Problem with Server Outage: Dear Support Team, there was an unexpected server outage during peak usage hours, which led to issues with user access. Th",Technical / Online Access,High,Forward to technical support team,True,,The ticket will be forwarded to the technical support team for urgent attention.
648,Support for the SaaS Project Management Platform: Inquiring about support for enhancements in the integration capabilities of the SaaS project managem,Technical / Online Access,Medium,Forward to technical support team,True,,The ticket will be forwarded to the technical support team for further assistance.
3238,"Inaccurate Investment Forecasts: Investment forecasts are not accurate. There seems to be an issue with the data analytics tool, which has been restar",Technical / Online Access,High,Request more information from customer,False,Could you please provide more details about the specific inaccuracies in the investment forecasts?,Would you like to proceed with the next steps?
15859,Medical Data Storage Payment Options: Could you please inform me about the different payment methods available for securing medical data storage servi,Billing / Payment,Medium,Send standard FAQ or self-service link,True,,This ticket will be directed to send the customer relevant information regarding payment options for securing medical data storage services.
747,"Exploring Digital Strategies for Brand Growth Online: Greetings Customer Support, I am reaching out to inquire about digital strategies that can impac",Other,Low,Request more information from customer,False,Could you clarify if you are looking for information specifically related to insurance digital strategies?,The customer will be asked to clarify if they are seeking information specifically related to digital strategies for insurance.
18708,"Recent Feedback on Delayed Response Times: In recent times, users have reported experiencing sluggish response times when accessing various features o",Technical / Online Access,High,Forward to technical support team,True,,Please proceed with forwarding the ticket to the technical support team.
10282,": The investment optimization project is facing delays due to data processing issues, which may be caused by server misconfiguration or software confl",Technical / Online Access,High,Forward to technical support team,True,,The ticket will be forwarded to the technical support team for assistance in troubleshooting and resolving the data processing issues related to the investment optimization project.
3501,Strategies for Brand Expansion through Digital Channels: Could you please share more details on your digital strategies for brand growth and the speci,Other,Low,Request more information from customer,False,Could you specify which specific services you are interested in regarding brand development?,I'll proceed to reach out to the customer to ask them to specify which specific services they are interested in regarding brand development.
2871,"Reduce Brand Engagement on Various Platforms: Facing a drop in brand engagement, requiring assistance.",Other,Medium,Request more information from customer,False,Could you please provide more details about the specific assistance you need regarding brand engagement?,I will reach out to the customer for further details regarding the specific assistance they need about the drop in brand engagement.
9494,Support Request: Issue with Updating Payment Method: I am encountering difficulties in updating the payment method for my company's account associated,Billing / Payment,High,Forward to billing team,True,,The ticket will be forwarded to the billing team for assistance with updating the payment method.
10424,Update Payment Security Protocols for HIPAA Compliance: I am writing to inform you that our organization requires updating our payment processing secu,Technical / Online Access,High,Forward to technical support team,True,,I will now proceed with forwarding the ticket to the technical support team.
8051,"Zoho CRM Integration Assistance Required: Hello Customer Support, I am inquiring about integrating Zoho CRM for project management. I am seeking guida",Technical / Online Access,Medium,Forward to technical support team,True,,The ticket will be forwarded to the technical support team for assistance with the Zoho CRM integration inquiry.
3625,Inquiry on ClickUp Integration Options: I am contacting you to seek information on the integration capabilities of ClickUp with other tools in my curr,Technical / Online Access,Medium,Send standard FAQ or self-service link,True,,You can proceed with sending the relevant information to the customer.
5453,Problems with Lead Generation Tracking: Encountering difficulties with lead generation conversion tracking across digital platforms. These issues migh,Technical / Online Access,High,Forward to technical support team,True,,I will proceed to forward the ticket to the technical support team for resolution.
930,"Concern about Social Media Engagement: Respected Customer Service Team, I am contacting you to address an urgent issue with our social media interacti",Other,Medium,Request more information from customer,False,Could you please clarify if you are seeking assistance with a specific aspect of your social media strategy that relates more to our services?,The next step is to contact the customer and ask for clarification regarding the specific aspect of their social media strategy that relates to the services provided by the insurance company.
14761,"Issue with Concurrent Integration Failures: Following a recent update to Node.js, multiple integrations have failed at the same time. There is a suspi",Technical / Online Access,High,Forward to technical support team,True,,This ticket will be forwarded to the technical support team for further assistance.
8717,Problem with Investment Analysis Software: The investment analysis application has encountered an unexpected failure. Steps already taken include a sy,Technical / Online Access,High,Forward to technical support team,True,,The ticket will be forwarded to the technical support team for further assistance.
19003,"Request for Cybersecurity Protocols for Medical Data Security in Hospitals: Dear Support Team, I am contacting you to seek advice on appropriate cyber",Technical / Online Access,Medium,Send standard FAQ or self-service link,True,,The ticket will be processed accordingly.
2347,"Issue with Medical Data Backup: Hello Customer Support, I am contacting you to notify about a problem with our medical data backups. The backups stopp",Technical / Online Access,High,Forward to technical support team,True,,Action will be taken to forward the ticket to the appropriate technical support team for resolution.
6368,"Enquiry Regarding Digital Strategy Services: Customer Support, we are reaching out to inquire about digital strategy services that integrate TYPO3 and",Other,Low,Send standard FAQ or self-service link,True,,The ticket will be handled accordingly by providing the customer with relevant FAQs or self-service resources regarding digital strategy services.
5439,": To the support team, there is a problem with my campaign metrics not updating, which might be a result of an API connection problem. I have already ",Technical / Online Access,Medium,Forward to technical support team,True,,The ticket is ready to be forwarded to the technical support team for further assistance.
6622,"Security Incident Notification: Dear Customer Support, I have encountered an incident that involves potential unauthorized access to medical data, whi",Technical / Online Access,High,Forward to technical support team,True,,The ticket will be forwarded to the technical support team for further assistance.
9492,Investment Optimization Tool Experiencing Intermittent Outages: The investment optimization tool has been experiencing intermittent outages that impac,Technical / Online Access,High,Forward to technical support team,True,,The ticket has been successfully triaged and will be forwarded to the technical support team for resolution.
