ticket_id,text_snippet,topic,urgency,next_action,is_complete,clarification_question,notes
3509,"Concerning suspected medical data leak via unsecured ClickUp dashboard: Dear Customer Support,\n\nI am contacting you to report a potential medical da",Technical / Online Access,High,Forward to technical support team,True,,The ticket will be forwarded to the technical support team for further investigation and assistance.
2107,"Implement Enhanced Project Management with Dynamics 365: Customer Support, initiating request for integrating Microsoft Dynamics 365 into the current ",Technical / Online Access,Medium,Request more information from customer,False,What specific features of the current system would you like to integrate with Dynamics 365?,The customer will be asked to specify the features of their current system they would like to integrate with Dynamics 365.
2222,"Concerns about Digital Campaign Launch: Hello Customer Support, I am contacting you to address an issue we are facing with our digital campaigns. We h",Technical / Online Access,High,Forward to technical support team,True,,The ticket will be forwarded to the technical support team for further assistance.
11548,Technical Glitches Resulting from System Overload: We have witnessed multiple instances of software crashes happening concurrently. It seems that the ,Technical / Online Access,High,Forward to technical support team,True,,The ticket will be routed accordingly for resolution.
3668,Problem with Software Stopping: The software has experienced multiple stops. There might be a fitting issue or a corrupted update.,Technical / Online Access,High,Request more information from customer,False,Could you provide more details about the software and the specific issues encountered?,It's important to gather further information to assist the customer effectively with their software issue.
17368,Request for Support on Digital Strategy Obstacle: Our marketing agency encountered a digital strategy issue. Despite efforts to resolve it through sof,Technical / Online Access,Medium,Request more information from customer,False,Could you please specify what the exact digital strategy issue is?,A request for more information has been initiated to clarify the specific digital strategy issue the marketing agency is facing.
5407,Problem with Digital Marketing Strategy: Our marketing agency is encountering difficulties in executing the digital strategy across various platforms.,Technical / Online Access,Medium,Forward to technical support team,True,,The ticket will be forwarded to the technical support team for further assistance.
1862,Assistance for Brand Expansion: Could we provide you with information on strategies? We are here to support your brand growth. Our team is willing to ,Other,Low,Send standard FAQ or self-service link,True,,The next step is to provide the customer with a standard FAQ or self-service link related to their inquiry.
16717,"Data Analytics Optimization: Dear Customer Support, I am contacting you to seek support in refining our data analytics tools for better investment ins",Technical / Online Access,Medium,Request more information from customer,False,Could you please specify the specific issues you are encountering with the data analysis processes?,You may need to follow up with the customer to gather more details about the specific issues they are facing with their data analysis processes.
15584,"Problem with Network: Hello Customer Support, I am facing occasional connection problems with the SaaS platform. It appears that the issue might be du",Technical / Online Access,High,Forward to technical support team,True,,The ticket will be forwarded to the technical support team for further assistance.
4484,Problems with Concurrent Tool Integrations: There were simultaneous failures with multiple tool integrations. This might be due to an API overload or ,Technical / Online Access,High,Forward to technical support team,True,,The ticket will be forwarded to the technical support team for further handling.
13142,": Customer Support, we are currently experiencing a service outage that is affecting multiple systems responsible for securing medical data. The issue",Technical / Online Access,High,Forward to technical support team,True,,I will now proceed to forward this ticket to the technical support team for urgent resolution.
2241,Query on Smart Home Products: I would like to understand the digital strategies that can enhance brand growth for smart home products. Could you share,Other,Low,Send standard FAQ or self-service link,True,,This ticket will be routed to send a standard FAQ or self-service link to address the customer's inquiry.
3180,"Attention to Duplicate Invoice Issue: Dear Customer Support, I am contacting you regarding an error with my recent invoice. I have received a duplicat",Billing / Payment,Medium,Forward to billing team,True,,The ticket will be forwarded to the billing team for further assistance on the duplicate invoice issue.
6290,"Server Downtime Issue: Customer Support, we are experiencing frequent downtime with our project management SaaS. Despite restarting the server, optimi",Technical / Online Access,High,Forward to technical support team,True,,The ticket should be forwarded to the technical support team for further assistance.
5541,Assistance with Sluggish Operation: The investment optimization tool is experiencing slow data analytics performance. After updating Ruby on Rails and,Technical / Online Access,High,Forward to technical support team,True,,This ticket will be routed to the appropriate technical support team for further assistance.
16836,"Strategies for Enhancing Online Brand Growth: Greetings Customer Support, \n\nI am writing to seek advice on the most efficient digital tactics for bo",Other,Low,Send standard FAQ or self-service link,True,,The ticket will be handled by providing relevant resources or links to assist the customer with their inquiries about digital strategies for brand growth.
9367,": Dear Customer Support, I am interested in exploring digital strategies to promote products such as Adobe Effects and Malwarebytes. Could you provide",Other,Low,Send standard FAQ or self-service link,True,,The ticket will be handled by sending the customer a standard FAQ or self-service link related to digital marketing strategies.
5215,"Support for Security Incident Involving Medical Data Exposure: A security breach was identified, which might have exposed medical data due to a softwa",Technical / Online Access,High,Forward to technical support team,True,,The ticket will be forwarded to the technical support team for further handling.
5535,"Incident of Medical Data Encryption: There was an unexpected failure in medical data encryption, likely due to an incompatibility with an Adobe Photos",Technical / Online Access,High,Forward to technical support team,True,,The ticket will be forwarded to the technical support team for further assistance.
2505,"Critical Error: A critical error has occurred during software integration with Avast, Adobe, and Magento, likely due to compatibility conflicts. Despi",Technical / Online Access,High,Forward to technical support team,True,,The ticket will be forwarded to the technical support team for further assistance.
7454,"Issues with Slow Data Processing in Excel: Customer Support,<br>Our financial firm is encountering slow data processing when analyzing investments wit",Technical / Online Access,Medium,Forward to technical support team,True,,The ticket will be forwarded to the technical support team for assistance with the slow data processing issue in Excel.
1556,"Issue with Excel Analysis Tool: Customer Support, recently the investment analysis tool has become unresponsive when processing large datasets in Exce",Technical / Online Access,Medium,Forward to technical support team,True,,The ticket will be forwarded to the technical support team for further assistance.
7926,"Enhancing Elasticsearch for Investment Data Analysis: Hello Customer Support, I am seeking your guidance on how to optimize investment data analysis u",Technical / Online Access,Medium,Forward to technical support team,True,,The ticket will be forwarded to the technical support team for assistance.
1021,Marketing Connectivity Issue: A significant problem has emerged regarding connectivity that is impacting our marketing strategies. This might be due t,Technical / Online Access,High,Forward to technical support team,True,,This ticket will be forwarded to the technical support team for further investigation and resolution.
13671,"Unapproved Access Efforts on Medical Information Noted: Had unapproved access efforts on medical information, possibly because of a misconfigured fire",Technical / Online Access,High,Forward to technical support team,True,,The ticket will now be forwarded to the technical support team for further assistance.
6920,Support Request for Data Analytics Tools: I am in search of data analytics tools to improve my investment strategies. Could you suggest some options? ,Other,Low,Send standard FAQ or self-service link,True,,You can proceed with sending the self-service link to the customer.
9318,Problem with Campaign Metrics Inaccuracy: There's an inconsistency in the reported engagement counts because of a synchronization problem with NZXT so,Technical / Online Access,High,Forward to technical support team,True,,The ticket will be forwarded to the technical support team for resolution.
69,"Support Request: Medical Data Encryption Issue: Dear Customer Support, I am inquiring about a problem I encountered with the medical data encryption p",Technical / Online Access,High,Forward to technical support team,True,,The ticket will be forwarded to the technical support team for further assistance.
18074,Enhance Digital Marketing Tools Effectively: We are seeking assistance in optimizing our digital marketing tools to enhance brand growth and visibilit,Other,Low,Send standard FAQ or self-service link,True,,No further action is needed at this time.
6265,Problem with analytics platform: The data analytics platform has frozen during investment optimization. This could possibly be due to insufficient mem,Technical / Online Access,Medium,Forward to technical support team,True,,"If you need anything else, feel free to ask!"
8885,Problem with Project Data Export Leading to Crashes: Users are encountering occasional crashes while exporting project data following the latest softw,Technical / Online Access,High,Forward to technical support team,True,,The ticket will be forwarded to the technical support team for further handling.
4831,Problems with Marketing Campaigns: Marketing campaigns are underperforming due to issues with our digital strategies and engagement. Despite attempts ,Other,Medium,Request more information from customer,True,,"If you need any further assistance with this ticket or other tickets, please let me know!"
8836,Incorrect Investment Prognoses Resulting in Substantial Financial Damages Daily: Incorrect investment projections have led to considerable financial l,Claims / Damage,High,Create or update a claim,True,,The ticket will be processed accordingly for claim creation or updating.
7641,"Intermittent Outages in Financial Software: We are encountering occasional outages in our financial software, such as Xero and Sage Accounting. This m",Technical / Online Access,High,Forward to technical support team,True,,I will proceed to forward this ticket to the technical support team for resolution.
2145,"Inquiry About Payment Options for Switch and MATLAB R2021a: Hello Customer Support, I am writing to seek information regarding the payment methods for",Billing / Payment,Medium,Send standard FAQ or self-service link,True,,You can proceed with sending the relevant information regarding payment options and accepted methods.
12101,"Enhancement for Project Reporting Features: Dear Customer Support Team, I am writing to request the integration of improved project reporting features",Other,Medium,Send standard FAQ or self-service link,True,,The ticket will be handled by sending a standard FAQ or self-service link.
4728,Problem with Medical Data Security During VR Training: A medical data leak occurred during a VR training session due to inadequate data encryption. De,Technical / Online Access,High,Forward to technical support team,True,,The ticket will be forwarded to the appropriate team for resolution.
12168,"Problems with Data Analytics Software: Hello Customer Support, I am facing difficulties with my data analytics software. It has crashed unexpectedly, ",Technical / Online Access,Medium,Forward to technical support team,True,,The ticket will be forwarded to the technical support team for further assistance.
1027,"Security Protocols for Medical Data Protection: Hello Customer Support, I am seeking information regarding the security measures implemented for the s",Technical / Online Access,Medium,Send standard FAQ or self-service link,True,,The ticket will be addressed by providing relevant information based on the security protocols for medical data protection.
6995,"Digital Strategy Performance Inquiry: Notices that the digital strategies are not performing as expected, which is affecting brand growth due to integ",Other,Medium,Request more information from customer,False,Can you provide more details about the specific integration challenges you're experiencing?,I will now request more information from the customer.
5741,"Technical Problem with Digital Tools: We have encountered a sudden service outage that is impacting multiple digital tools, which is affecting our mar",Technical / Online Access,High,Forward to technical support team,True,,The ticket will be forwarded to the appropriate team for resolution.
714,Request for Detailed Billing Information for Digitalkamera ESET NOD32 Antivirus 14: Could you please provide detailed information regarding the billin,Billing / Payment,Medium,Forward to billing team,True,,The ticket will be forwarded to the billing team for further assistance.
3680,Digital campaigns showing poor performance: Limited data analysis tools are currently utilized,Other,Low,Request more information from customer,False,What specific issues or questions do you have regarding the digital campaigns?,I will now initiate a request for more information from the customer regarding their specific issues or questions about the digital campaigns.
369,Support Required for System Outages: We are facing system outages across multiple integrations on our SaaS project management platform following recen,Technical / Online Access,High,Forward to technical support team,True,,The ticket will be forwarded to the technical support team for further assistance.
17185,Ensuring Medical Data Security Compliance: I am inquiring about support and guidance on securing access to medical data using Outlook 2021. Could you ,Technical / Online Access,Medium,Forward to technical support team,True,,This ticket will be routed to the relevant team for further assistance.
7040,Elasticsearch 7.13 Integration Prerequisites: Could you please outline the necessary setup requirements for integrating with Elasticsearch 7.13?,Technical / Online Access,Medium,Request more information from customer,False,What specific integration requirements or issues are you facing?,"The customer will be asked: ""What specific integration requirements or issues are you facing?"""
3900,Support for Traffic Decline: There has been a sudden decrease in website traffic and engagement metrics. This may be due to recent changes in digital ,Technical / Online Access,Medium,Forward to technical support team,True,,The ticket will be routed accordingly.
18081,Medical Information Exposed Through Software Glitch: Data confidentiality breached because of insecure system connection. Encryption standards not met,Technical / Online Access,High,Forward to technical support team,True,,The ticket will be forwarded to the technical support team for further action.
13898,": Dear Customer Support, <br>The investment optimization system of the financial firm is encountering data discrepancies that may be due to integratio",Technical / Online Access,High,Forward to technical support team,True,,The ticket will be forwarded to the technical support team for prompt assistance.
14116,"Support Required for Data Breach in Medical Systems: Our medical data systems have experienced a data breach, which might be due to outdated security ",Technical / Online Access,High,Forward to technical support team,True,,The ticket will be forwarded to the technical support team for further assistance.
4658,"Problem with Google Meet: Noted experiencing connectivity issues during video conferences, possibly due to network congestion and software conflicts.",Technical / Online Access,Medium,Forward to technical support team,True,,"- **Topic:** Technical / Online Access
- **Urgency Score:** Medium
- **Completeness:** Complete
- **Next Action:** Forward to technical support team"
11607,Security Measures for Safeguarding Medical Data: Seeking advice on implementing advanced security protocols to protect medical data in our hospital's ,Technical / Online Access,High,Forward to technical support team,True,,This ticket will be forwarded to the appropriate technical support team for handling.
9699,"Assistance with Analytics Platform: The analytics platform has encountered an unexpected outage in processing investment data, which could be due to s",Technical / Online Access,High,Forward to technical support team,True,,The ticket will be forwarded to the technical support team to address the issue with the analytics platform.
6591,Misleading Data in Investment Analytics Reports: Incorrect data and flawed recommendations are reported in the documents.,Other,Medium,Request more information from customer,False,Could you provide more details on the specific incorrect data and recommendations?,"- **Topic:** Other
- **Urgency Score:** Medium
- **Completeness:** Incomplete (Requested more details on the specific incorrect data and recommendations)
- **Next Action:** Request more information from the customer."
7244,Brand Expansion Services: I am eager to gain more insight into your digital tactics for brand expansion and development services. Could you share more,Other,Low,Send standard FAQ or self-service link,True,,You can proceed to send the requested information or direct the customer to relevant resources.
6025,"Query Regarding Overcharge Due to Duplicate Subscriptions: Hello Customer Support, I hope this message finds you well. I am reaching out to address an",Billing / Payment,Medium,Forward to billing team,True,,The ticket will be forwarded to the billing team for further assistance.
15768,Revise Sales Aids: Updating sales aids can boost client interaction.,Other,Low,Request more information from customer,False,What specific revisions are needed for the sales aids?,"If there's anything else you need, feel free to ask!"
2553,Project Management Inquiry: Inquiring about integration options for our customer support with Zapier's project management SaaS. Could you please provi,Other,Low,Send standard FAQ or self-service link,True,,The next step is to send the customer a standard FAQ or self-service link regarding integration options and support documentation.
1417,Problem Sudden Increase in System Latency During Peak Usage Hours: Noted a sudden spike in system latency during peak usage hours. This might be due t,Technical / Online Access,High,Forward to technical support team,True,,The ticket will be forwarded to the technical support team for resolution.
16775,Marketing Growth Challenges Increase: The marketing agency's digital strategies have not been effective in driving growth. There seems to be ineffecti,Other,Medium,Request more information from customer,True,,"Since the issue seems to be more about marketing and strategies rather than a direct insurance topic, requesting more information will help clarify what specific assistance is needed from the insurance perspective."
18725,Team Collaboration: Seeking information on collaboration features and integrations within a project management SaaS platform to enhance teamwork and c,Other,Low,Send standard FAQ or self-service link,True,,The next action will be to provide the customer with a standard FAQ or self-service link related to collaboration features and integrations.
5913,Boost Digital Marketing Tactics: Request for enhancements in digital strategies and marketing tools. Aim is to boost brand growth and engagement acros,Other,Low,Send standard FAQ or self-service link,True,,You can proceed with sending the relevant information to the customer regarding digital marketing strategies and tools.
3922,"Support Request for System Outage: An unexpected system outage has impacted key tools used for investment optimization, potentially due to a recent so",Technical / Online Access,High,Forward to technical support team,True,,The ticket will be forwarded to the technical support team for urgent resolution.
19581,"Report on Security Breach in Hospital System: Hello Customer Support, a data breach has been detected in the hospital's system, which might have expos",Technical / Online Access,High,Forward to technical support team,True,,The ticket will be forwarded to the technical support team for further investigation and assistance regarding the security breach.
14586,": In regards to the report on the data breach in the hospital's system, sensitive medical data has been compromised. The breach might have happened du",Technical / Online Access,High,Forward to technical support team,True,,The ticket will be forwarded to the technical support team for immediate attention.
10444,"Notification of Medical Data Breach: To Customer Support, I am contacting you to report a medical data breach that has happened unexpectedly. It seems",Technical / Online Access,High,Forward to technical support team,True,,I will proceed to forward this ticket to the technical support team for further assistance.
6342,"Unexpected Crash of SaaS Platform Possibly Due to Overload: Hello Customer Support, I am contacting you to report an unexpected crash of our SaaS plat",Technical / Online Access,High,Forward to technical support team,True,,The ticket will be forwarded to the technical support team for further investigation and resolution.
3421,Frequent Login Issues Noted During Peak Times: Users are experiencing intermittent login failures during peak hours. This might be due to server overl,Technical / Online Access,High,Forward to technical support team,True,,The ticket will be forwarded to the technical support team for investigation and resolution.
3500,: Looking for customer support on integration strategies for Apple macOS Monterey. Could you provide some relevant information or documentation on thi,Other,Low,Send standard FAQ or self-service link,True,,You can proceed with sending the customer helpful resources or documentation related to integration strategies for macOS Monterey.
16061,Concerns with Financial Firm's Data Analytics Tools: A financial firm encountered operational problems with their data analytics tools during the inve,Technical / Online Access,Medium,Forward to technical support team,True,,The ticket will be forwarded to the technical support team for further assistance.
18361,Request for Documentation on MySQL Integration: Is it possible to provide comprehensive documentation for integrating MySQL with SaaS project manageme,Technical / Online Access,Medium,Send standard FAQ or self-service link,True,,The ticket will be handled by providing the relevant documentation or resources for MySQL integration with the SaaS project management software.
15672,"Unsynchronized project timelines experienced today once more: Greetings Customer Support, I am reaching out to report an issue with project timelines ",Technical / Online Access,High,Forward to technical support team,True,,The ticket will be forwarded to the technical support team for urgent assistance.
13179,"Proposal for Updating Digital Marketing Strategies to Enhance Business Growth: Hello Customer Support, I am contacting you to emphasize the necessity ",Other,Medium,Request more information from customer,True,,"If you need any further assistance with this ticket, let me know!"
6796,Concern Over Investment Forecast Precision Today: I would like to bring to your attention a problem with the precision of our investment forecasts. Th,Technical / Online Access,Medium,Forward to technical support team,True,,The ticket will be forwarded to the technical support team for further assistance.
8931,Synchronization Difficulty: Project schedules are not synchronizing between different teams. There might be a problem with the API connections. I have,Technical / Online Access,High,Forward to technical support team,True,,The ticket will be forwarded to the technical support team for resolution.
18282,Marketing Campaigns Not Performing Well: Our marketing campaigns are not performing as expected. Despite attempts to adjust ad spending and update mat,Other,Medium,Send standard FAQ or self-service link,True,,You can proceed with sending the relevant information to the customer.
4940,Problem with Investment Forecasting Service: The investment forecasts have been abruptly stopped. Potential reason: An issue with data feed integratio,Technical / Online Access,High,Forward to technical support team,True,,The ticket will be forwarded to the technical support team for urgent assistance.
978,Support Request for Smartsheet and PostgreSQL Integration: I am inquiring about the available documentation for integrating Smartsheet with PostgreSQL,Technical / Online Access,Medium,Send standard FAQ or self-service link,True,,You can proceed with sending the appropriate resources or guides related to the integration of Smartsheet with PostgreSQL.
